<?xml version="1.0" encoding="UTF-8"?>
<matricula  xmlns:xsi="http://www.w3.org/2001/XMLSchema-instance"
xsi:noNamespaceSchemaLocation="matricula.xsd">
<personal>
     <dni>99223366M</dni>
     <nombre>Juan Pardo Martin</nombre>
     <titulacion>Ingenieria Informática</titulacion>
     <curso_academico>1997-1998</curso_academico>
     <domicilios>
        <domicilio tipo="familiar">
          <nombre>C/Principal n 1</nombre>        
        
        </domicilio>
         <domicilio tipo="habitual">
          <nombre>C/secundaria n 2</nombre>        
                </domicilio>
          
     </domicilios>
</personal>
<pago>

<tipo_matricula>Matrícula Ordinaria</tipo_matricula>
</pago>
</matricula>
